{
  "orgName": "Dreamhouse",
  "edition": "Developer",
  "hasSampleData": false,
  "settings": {
    "orgPreferenceSettings": {
      "networksEnabled": true,

      "s1DesktopEnabled": true,

      "s1EncryptedStoragePref2": false
    },
    "omniChannelSettings": {
      "enableOmniChannel": true
    },
    "caseSettings": {
      "systemUserEmail": "support@acme.com"
    }
  }
}
